{
    "$schema": "http://json-schema.org/draft-07/schema#",
    "additionalProperties": false,
    "definitions": {
        "ConfigMetadata": {
            "anyOf": [
                {
                    "$ref": "#/definitions/ConfigMetadataBoolean"
                },
                {
                    "$ref": "#/definitions/ConfigMetadataCategorical"
                },
                {
                    "$ref": "#/definitions/ConfigMetadataQuantitative"
                }
            ]
        },
        "ConfigMetadataBoolean": {
            "additionalProperties": false,
            "properties": {
                "column": {
                    "type": "string"
                },
                "label": {
                    "type": "string"
                },
                "labels": {
                    "additionalProperties": false,
                    "properties": {
                        "false": {
                            "type": "string"
                        },
                        "null": {
                            "type": "string"
                        },
                        "true": {
                            "type": "string"
                        }
                    },
                    "required": [
                        "false",
                        "null",
                        "true"
                    ],
                    "type": "object"
                },
                "type": {
                    "enum": [
                        "boolean"
                    ],
                    "type": "string"
                },
                "values": {
                    "additionalProperties": false,
                    "properties": {
                        "false": {
                            "type": "string"
                        },
                        "true": {
                            "type": "string"
                        }
                    },
                    "required": [
                        "false",
                        "true"
                    ],
                    "type": "object"
                }
            },
            "required": [
                "column",
                "label",
                "type"
            ],
            "type": "object"
        },
        "ConfigMetadataCategorical": {
            "additionalProperties": false,
            "properties": {
                "column": {
                    "type": "string"
                },
                "label": {
                    "type": "string"
                },
                "type": {
                    "enum": [
                        "categorical"
                    ],
                    "type": "string"
                },
                "width": {
                    "type": "number"
                }
            },
            "required": [
                "column",
                "label",
                "type"
            ],
            "type": "object"
        },
        "ConfigMetadataQuantitative": {
            "additionalProperties": false,
            "properties": {
                "column": {
                    "type": "string"
                },
                "decimals": {
                    "type": "number"
                },
                "label": {
                    "type": "string"
                },
                "maxValue": {
                    "type": "number"
                },
                "suffix": {
                    "type": "string"
                },
                "type": {
                    "enum": [
                        "quantitative"
                    ],
                    "type": "string"
                },
                "width": {
                    "type": "number"
                }
            },
            "required": [
                "column",
                "label",
                "type"
            ],
            "type": "object"
        }
    },
    "properties": {
        "apiUrl": {
            "type": "string"
        },
        "apps": {
            "items": {
                "type": "string"
            },
            "type": "array"
        },
        "homology": {
            "additionalProperties": false,
            "properties": {
                "alignmentMetadata": {
                    "items": {
                        "$ref": "#/definitions/ConfigMetadata"
                    },
                    "type": "array"
                },
                "annotations": {
                    "items": {
                        "additionalProperties": false,
                        "description": "Configuration.\n\nWhen making changes, be sure to update the config validator by running:\n  npm run generate-validators",
                        "properties": {
                            "column": {
                                "type": "string"
                            },
                            "label": {
                                "type": "string"
                            }
                        },
                        "required": [
                            "column",
                            "label"
                        ],
                        "type": "object"
                    },
                    "type": "array"
                },
                "defaultId": {
                    "type": "string"
                },
                "defaultSequenceMetadataColumns": {
                    "items": {
                        "type": "string"
                    },
                    "type": "array"
                },
                "homologyMetadata": {
                    "items": {
                        "$ref": "#/definitions/ConfigMetadata"
                    },
                    "type": "array"
                },
                "sequenceMetadata": {
                    "items": {
                        "$ref": "#/definitions/ConfigMetadata"
                    },
                    "type": "array"
                },
                "trees": {
                    "items": {
                        "additionalProperties": false,
                        "properties": {
                            "filename": {
                                "type": "string"
                            },
                            "label": {
                                "type": "string"
                            }
                        },
                        "required": [
                            "filename",
                            "label"
                        ],
                        "type": "object"
                    },
                    "type": "array"
                },
                "variableMetadata": {
                    "items": {
                        "$ref": "#/definitions/ConfigMetadata"
                    },
                    "type": "array"
                }
            },
            "type": "object"
        },
        "title": {
            "type": "string"
        }
    },
    "type": "object"
}

